postion,page_no,archival_tiff,web_jpeg,thumbnail_jpeg
1,Lewis T398 front a,master/8877_0000.tif,web/8877_0000_web.jpg,thumb/8877_0000_thumb.jpg
2,Lewis T398 reverse a,master/8877_0001.tif,web/8877_0001_web.jpg,thumb/8877_0001_thumb.jpg
3,Lewis T398 front b,master/8877_0002.tif,web/8877_0002_web.jpg,thumb/8877_0002_thumb.jpg
4,Lewis T398 reverse b,master/8877_0003.tif,web/8877_0003_web.jpg,thumb/8877_0003_thumb.jpg
5,Lewis T398 front c,master/8877_0004.tif,web/8877_0004_web.jpg,thumb/8877_0004_thumb.jpg
6,Lewis T398 reverse c,master/8877_0005.tif,web/8877_0005_web.jpg,thumb/8877_0005_thumb.jpg
