postion,page_no,archival_tiff,web_jpeg,thumbnail_jpeg
1,Lewis T666 front a,master/9105_0000.tif,web/9105_0000_web.jpg,thumb/9105_0000_thumb.jpg
2,Lewis T666 reverse a,master/9105_0001.tif,web/9105_0001_web.jpg,thumb/9105_0001_thumb.jpg
3,Lewis T666 front b,master/9105_0002.tif,web/9105_0002_web.jpg,thumb/9105_0002_thumb.jpg
4,Lewis T666 reverse b,master/9105_0003.tif,web/9105_0003_web.jpg,thumb/9105_0003_thumb.jpg
5,Lewis T666 front c,master/9105_0004.tif,web/9105_0004_web.jpg,thumb/9105_0004_thumb.jpg
6,Lewis T666 reverse c,master/9105_0005.tif,web/9105_0005_web.jpg,thumb/9105_0005_thumb.jpg
7,Lewis T666 front d,master/9105_0006.tif,web/9105_0006_web.jpg,thumb/9105_0006_thumb.jpg
8,Lewis T666 reverse d,master/9105_0007.tif,web/9105_0007_web.jpg,thumb/9105_0007_thumb.jpg
